{
  "$schema": "http://json-schema.org/draft-07/schema#",
  "title": "LearningEntry",
  "description": "A single entry in the learning store (project or global tier). Written by learning_write, updated by learning_verify, promoted by conventions_write_promoted.",
  "type": "object",
  "required": [
    "id",
    "pattern",
    "fix",
    "tier",
    "created_at",
    "last_seen",
    "hits",
    "confidence",
    "archived",
    "promotion_candidate"
  ],
  "additionalProperties": true,
  "properties": {
    "id": {
      "type": "string",
      "pattern": "^learn-[0-9a-f]+$",
      "description": "Unique identifier generated by learning_write."
    },
    "pattern": {
      "type": "string",
      "minLength": 1,
      "description": "Error signature or code pattern this entry addresses."
    },
    "fix": {
      "type": "string",
      "minLength": 1,
      "description": "The corrective action that resolved the pattern."
    },
    "tier": {
      "type": "string",
      "enum": [
        "feature",
        "project",
        "global"
      ],
      "description": "Store tier where this entry lives."
    },
    "created_at": {
      "type": "string",
      "format": "date-time",
      "description": "ISO-8601 timestamp when the entry was first written."
    },
    "last_seen": {
      "type": "string",
      "format": "date-time",
      "description": "ISO-8601 timestamp of the most recent hit."
    },
    "hits": {
      "type": "integer",
      "minimum": 1,
      "description": "Total number of times this pattern was encountered."
    },
    "success_count": {
      "type": "integer",
      "minimum": 0,
      "description": "Number of times the fix succeeded (updated by learning_verify)."
    },
    "failure_count": {
      "type": "integer",
      "minimum": 0,
      "description": "Number of times the fix failed (updated by learning_verify)."
    },
    "confidence": {
      "type": "number",
      "minimum": 0,
      "maximum": 1,
      "description": "success_count / (success_count + failure_count); 0.5 until verified."
    },
    "ttl_days": {
      "type": "integer",
      "minimum": 1,
      "description": "Days before the entry expires (default: 90)."
    },
    "archived": {
      "type": "boolean",
      "description": "True when the entry has been pruned, expired, or manually archived."
    },
    "promotion_candidate": {
      "type": "boolean",
      "description": "True when confidence >= 0.8 AND hits >= 3 — eligible for conventions_write_promoted."
    },
    "promoted_at": {
      "type": "string",
      "format": "date-time",
      "description": "ISO-8601 timestamp set by conventions_write_promoted when the entry was written to AGENTS.md."
    },
    "archived_at": {
      "type": "string",
      "format": "date-time",
      "description": "ISO-8601 timestamp set by learning_archive when the entry was manually archived."
    }
  }
}
