[
  {
    "id": "learn-00000001",
    "pattern": "prd:overview missing",
    "fix": "Use Overview as a Problem alias when accepted by the validator.",
    "tier": "project",
    "created_at": "2026-03-01T08:00:00.000Z",
    "last_seen": "2026-03-02T08:00:00.000Z",
    "hits": 1,
    "success_count": 1,
    "failure_count": 0,
    "confidence": 1,
    "ttl_days": 90,
    "archived": false,
    "promotion_candidate": false
  },
  {
    "id": "learn-00000002",
    "pattern": "techspec:absolute path emitted",
    "fix": "Normalize file layout entries to repo-relative paths.",
    "tier": "project",
    "created_at": "2026-03-02T08:00:00.000Z",
    "last_seen": "2026-03-04T08:00:00.000Z",
    "hits": 2,
    "success_count": 1,
    "failure_count": 0,
    "confidence": 1,
    "ttl_days": 90,
    "archived": false,
    "promotion_candidate": false
  },
  {
    "id": "learn-00000003",
    "pattern": "tasks:duplicate task id",
    "fix": "Generate monotonic task ids per feature.",
    "tier": "project",
    "created_at": "2026-03-03T08:00:00.000Z",
    "last_seen": "2026-03-06T08:00:00.000Z",
    "hits": 3,
    "success_count": 2,
    "failure_count": 0,
    "confidence": 1,
    "ttl_days": 90,
    "archived": false,
    "promotion_candidate": true
  },
  {
    "id": "learn-00000004",
    "pattern": "code:bash array under set -u",
    "fix": "Guard optional variables with default expansion.",
    "tier": "project",
    "created_at": "2026-03-04T08:00:00.000Z",
    "last_seen": "2026-03-08T08:00:00.000Z",
    "hits": 4,
    "success_count": 3,
    "failure_count": 1,
    "confidence": 0.75,
    "ttl_days": 90,
    "archived": false,
    "promotion_candidate": false
  },
  {
    "id": "learn-00000005",
    "pattern": "tests:shellcheck omitted",
    "fix": "Run shellcheck for changed shell entry points before shipping.",
    "tier": "project",
    "created_at": "2026-03-05T08:00:00.000Z",
    "last_seen": "2026-03-10T08:00:00.000Z",
    "hits": 5,
    "success_count": 5,
    "failure_count": 0,
    "confidence": 1,
    "ttl_days": 180,
    "archived": false,
    "promotion_candidate": true
  },
  {
    "id": "learn-00000006",
    "pattern": "pr:missing release note",
    "fix": "Add a concise release note for every user-visible CLI change.",
    "tier": "project",
    "created_at": "2026-03-06T08:00:00.000Z",
    "last_seen": "2026-03-12T08:00:00.000Z",
    "hits": 6,
    "success_count": 4,
    "failure_count": 2,
    "confidence": 0.6666666667,
    "ttl_days": 90,
    "archived": false,
    "promotion_candidate": false
  },
  {
    "id": "learn-00000007",
    "pattern": "run:resume resets cost",
    "fix": "Load cost.json before applying max-cost checks on resume.",
    "tier": "project",
    "created_at": "2026-03-07T08:00:00.000Z",
    "last_seen": "2026-03-14T08:00:00.000Z",
    "hits": 7,
    "success_count": 7,
    "failure_count": 0,
    "confidence": 1,
    "ttl_days": 180,
    "archived": false,
    "promotion_candidate": true
  },
  {
    "id": "learn-00000008",
    "pattern": "loop:stdin comments not ignored",
    "fix": "Filter blank and # comment lines before validating loop ids.",
    "tier": "project",
    "created_at": "2026-03-08T08:00:00.000Z",
    "last_seen": "2026-03-16T08:00:00.000Z",
    "hits": 8,
    "success_count": 6,
    "failure_count": 2,
    "confidence": 0.75,
    "ttl_days": 90,
    "archived": false,
    "promotion_candidate": false
  },
  {
    "id": "learn-00000009",
    "pattern": "memory:stale learning archived",
    "fix": "Keep archived entries out of prompt injection.",
    "tier": "project",
    "created_at": "2026-03-09T08:00:00.000Z",
    "last_seen": "2026-03-18T08:00:00.000Z",
    "hits": 9,
    "success_count": 4,
    "failure_count": 5,
    "confidence": 0.4444444444,
    "ttl_days": 90,
    "archived": true,
    "promotion_candidate": false
  },
  {
    "id": "learn-00000010",
    "pattern": "schema:jsonl append corrupts file",
    "fix": "Append one JSON object per line and keep JSON files atomic.",
    "tier": "project",
    "created_at": "2026-03-10T08:00:00.000Z",
    "last_seen": "2026-03-20T08:00:00.000Z",
    "hits": 10,
    "success_count": 10,
    "failure_count": 0,
    "confidence": 1,
    "ttl_days": 180,
    "archived": false,
    "promotion_candidate": true
  },
  {
    "id": "learn-00000011",
    "pattern": "agent:codex prompt misses artifact path",
    "fix": "Render artifact path explicitly in the phase prompt.",
    "tier": "project",
    "created_at": "2026-03-11T08:00:00.000Z",
    "last_seen": "2026-03-22T08:00:00.000Z",
    "hits": 11,
    "success_count": 8,
    "failure_count": 3,
    "confidence": 0.7272727273,
    "ttl_days": 90,
    "archived": false,
    "promotion_candidate": false
  },
  {
    "id": "learn-00000012",
    "pattern": "doctor:missing optional cli blocks exit",
    "fix": "Warn for optional tools and fail only required dependencies.",
    "tier": "project",
    "created_at": "2026-03-12T08:00:00.000Z",
    "last_seen": "2026-03-24T08:00:00.000Z",
    "hits": 12,
    "success_count": 12,
    "failure_count": 0,
    "confidence": 1,
    "ttl_days": 180,
    "archived": false,
    "promotion_candidate": true
  }
]
