[
  {
    "id": "learn-a1b2c3d4",
    "pattern": "prd:missing problem statement",
    "fix": "Include a Problem section before Success Criteria.",
    "tier": "project",
    "created_at": "2026-05-01T10:00:00.000Z",
    "last_seen": "2026-05-02T10:00:00.000Z",
    "hits": 2,
    "success_count": 1,
    "failure_count": 0,
    "confidence": 1,
    "ttl_days": 90,
    "archived": false,
    "promotion_candidate": false
  },
  {
    "id": "learn-b2c3d4e5",
    "pattern": "techspec:missing file layout",
    "fix": "Add File Layout with relative paths touched by the feature.",
    "tier": "project",
    "created_at": "2026-05-03T11:00:00.000Z",
    "last_seen": "2026-05-04T11:00:00.000Z",
    "hits": 3,
    "success_count": 3,
    "failure_count": 0,
    "confidence": 1,
    "ttl_days": 60,
    "archived": false,
    "promotion_candidate": true
  }
]
