[
  {
    "id": "learn-c3d4e5f6",
    "pattern": "tasks:task missing acceptance criteria",
    "fix": "Add acceptanceCriteria for every task object.",
    "tier": "project",
    "created_at": "2026-04-20T09:00:00.000Z",
    "last_seen": "2026-04-21T09:00:00.000Z",
    "hits": 1,
    "success_count": 0,
    "failure_count": 0,
    "confidence": 0.5,
    "ttl_days": 90,
    "archived": false,
    "promotion_candidate": false
  },
  {
    "id": "learn-d4e5f6a7",
    "pattern": "code:shell trap uses local tmpdir after return",
    "fix": "Expand tmpdir when setting RETURN traps.",
    "tier": "project",
    "created_at": "2026-04-22T09:00:00.000Z",
    "last_seen": "2026-04-25T09:00:00.000Z",
    "hits": 4,
    "success_count": 4,
    "failure_count": 0,
    "confidence": 1,
    "ttl_days": 120,
    "archived": false,
    "promotion_candidate": true
  },
  {
    "id": "learn-e5f6a7b8",
    "pattern": "tests:bats fixture leaves HOME dirty",
    "fix": "Set HOME to a temp directory inside setup.",
    "tier": "project",
    "created_at": "2026-04-23T09:00:00.000Z",
    "last_seen": "2026-04-24T09:00:00.000Z",
    "hits": 2,
    "success_count": 1,
    "failure_count": 1,
    "confidence": 0.5,
    "ttl_days": 90,
    "archived": false,
    "promotion_candidate": false
  },
  {
    "id": "learn-f6a7b8c9",
    "pattern": "pr:body omits tests",
    "fix": "List only checks that actually ran in the PR body.",
    "tier": "project",
    "created_at": "2026-04-24T09:00:00.000Z",
    "last_seen": "2026-04-26T09:00:00.000Z",
    "hits": 3,
    "success_count": 2,
    "failure_count": 1,
    "confidence": 0.6666666667,
    "ttl_days": 90,
    "archived": false,
    "promotion_candidate": false
  },
  {
    "id": "learn-a7b8c9d0",
    "pattern": "schema:invalid enum accepted",
    "fix": "Use the schema enum as the validator source of truth.",
    "tier": "project",
    "created_at": "2026-04-25T09:00:00.000Z",
    "last_seen": "2026-04-27T09:00:00.000Z",
    "hits": 5,
    "success_count": 5,
    "failure_count": 0,
    "confidence": 1,
    "ttl_days": 180,
    "archived": false,
    "promotion_candidate": true
  }
]
