[
  {
    "id": "learn-global01",
    "pattern": "global:shell scripts need shellcheck",
    "fix": "Run shellcheck on changed shell scripts before opening a PR.",
    "tier": "global",
    "created_at": "2026-02-01T08:00:00.000Z",
    "last_seen": "2026-02-03T08:00:00.000Z",
    "hits": 3,
    "success_count": 3,
    "failure_count": 0,
    "confidence": 1,
    "ttl_days": 180,
    "archived": false,
    "promotion_candidate": true
  }
]
