[
  {
    "id": "learn-feature01",
    "pattern": "feature:local validator alias",
    "fix": "Accept local heading aliases before retrying the phase.",
    "tier": "feature",
    "created_at": "2026-02-10T08:00:00.000Z",
    "last_seen": "2026-02-11T08:00:00.000Z",
    "hits": 1,
    "success_count": 1,
    "failure_count": 0,
    "confidence": 1,
    "ttl_days": 30,
    "archived": false,
    "promotion_candidate": false
  }
]
